{
  "id": "ecommerce",
  "version": "1.0.0",
  "type": "multi-agent",
  "metadata": {
    "name": "E-Commerce Operations",
    "description": "E-commerce operations team managing listings, pricing, inventory, promotions and analytics",
    "category": "operations",
    "icon": "storefront",
    "color": "from-orange-500 to-amber-500",
    "tags": [
      "ecommerce",
      "operations",
      "retail",
      "marketing"
    ],
    "author": "ClawDeckX Team",
    "scope": "multi-agent"
  },
  "content": {
    "agents": [],
    "workflow": {
      "type": "collaborative",
      "description": "",
      "steps": []
    },
    "prompts": {
      "step1": {
        "en": "Output ONLY valid JSON, no markdown.\n\nYou are designing an E-Commerce Operations multi-agent team.\nScenario: {{scenarioName}}\nDescription: {{description}}\nAgents: {{agentCount}}\nWorkflow: collaborative\n\nCreate a realistic e-commerce ops team. Typical roles: product listing specialist (catalog, SEO, images), pricing & promotions analyst (competitive pricing, discount campaigns), inventory manager (stock levels, supplier coordination, replenishment), customer experience agent (reviews, returns, CX metrics), analytics & reporting lead (sales data, KPIs, growth insights). Adjust for team size.\n\nFor each agent: id (kebab-case), name, role (≤8 words), description (≤20 words), icon (Material Symbol), color (Tailwind gradient).\nreasoning: ≤15 words. Workflow: collaborative with clear handoffs between catalog, pricing, operations, and analytics stages.\n\n{\"reasoning\":\"\",\"template\":{\"id\":\"\",\"name\":\"\",\"description\":\"\",\"agents\":[{\"id\":\"\",\"name\":\"\",\"role\":\"\",\"description\":\"\",\"icon\":\"\",\"color\":\"\"}],\"workflow\":{\"type\":\"collaborative\",\"description\":\"\",\"steps\":[{\"agent\":\"\",\"action\":\"\"}]}}}",
        "zh": "只输出合法JSON，不要Markdown。\n\n你正在设计一个电商运营多智能体团队。\n场景：{{scenarioName}}\n描述：{{description}}\n智能体数量：{{agentCount}}\n工作流：协作\n\n创建一个符合实际的电商运营团队。典型角色：商品上架专员（商品目录、SEO、图片）、定价与促销分析师（竞品定价、折扣活动）、库存管理员（库存水位、供应商协调、补货）、客户体验专员（评价、退换货、CX指标）、数据分析与报告负责人（销售数据、KPI、增长洞察）。根据团队规模调整。\n\n每个智能体：id（短横线格式）、名称、角色（≤8字）、描述（≤20字）、图标（Material Symbol）、颜色（Tailwind渐变）。\n推理：≤15字。工作流：协作模式，商品目录、定价、运营和数据分析各阶段之间有清晰交接。\n\n{\"reasoning\":\"\",\"template\":{\"id\":\"\",\"name\":\"\",\"description\":\"\",\"agents\":[{\"id\":\"\",\"name\":\"\",\"role\":\"\",\"description\":\"\",\"icon\":\"\",\"color\":\"\"}],\"workflow\":{\"type\":\"collaborative\",\"description\":\"\",\"steps\":[{\"agent\":\"\",\"action\":\"\"}]}}}"
      },
      "agentFile": {
        "en": "Output ONLY valid JSON. No markdown fences, no explanation.\n\nYou are writing OpenClaw agent workspace files for a multi-agent system.\nAgent name: {{agentName}}\nAgent role: {{agentRole}}\nAgent description: {{agentDesc}}\nTeam / Scenario: {{scenarioName}}\nWrite all content in: English\n\nFILE SPECIFICATIONS — follow these exactly:\n\nSOUL.md — Persona, tone, and boundaries. Loaded every session.\n  - Write in first person as the agent.\n  - Cover: who this agent is, what they care about, their working principles, communication style.\n  - 3–5 short paragraphs. Use markdown headers: ## Core Truths, ## Boundaries, ## Vibe\n  - Be specific to this agent's role. No generic AI platitudes.\n\nAGENTS.md — Operating instructions and memory rules. Loaded every session.\n  - Must start with \"## Session Startup\" listing files to read on wake-up:\n    1. Read SOUL.md — this is who you are\n    2. Read USER.md — this is who you're helping\n    3. Read memory/YYYY-MM-DD.md (today + yesterday) for recent context\n  - Must include \"## Red Lines\" (things this agent must never do in its role).\n  - Must include role-specific operating rules, priorities, and collaboration notes.\n  - Use markdown headers and bullet lists throughout.\n\nUSER.md — Profile of the human this agent serves. Loaded every session.\n  - Must use this exact template format (leave values blank — agent fills them from real interactions):\n    # USER.md - About Your Human\n\n    - **Name:**\n    - **What to call them:**\n    - **Pronouns:** _(optional)_\n    - **Timezone:**\n    - **Notes:**\n\n    ## Context\n\n    _(What do they care about relevant to this agent's role? What are their goals? Build this over time.)_\n  - Do NOT pre-fill field values.\n\nIDENTITY.md — The agent's name, creature, vibe, and emoji. Created during bootstrap.\n  - Must use this exact format (multi-line, one field per line):\n    # IDENTITY.md - Who Am I?\n\n    - **Name:** (a fitting name for this agent's role)\n    - **Creature:** (AI? specialist? advisor? something fitting the role)\n    - **Vibe:** (2–4 words: how this agent comes across — sharp? warm? precise?)\n    - **Emoji:** (one emoji that fits this agent's personality)\n  - Do NOT add extra fields beyond Name, Creature, Vibe, Emoji.\n\nHEARTBEAT.md — Short periodic checklist for background proactive work. Keep minimal.\n  - Format: markdown checklist \"- [ ] task\"\n  - 2–4 items MAX. Each must be specific and actionable for this agent's role.\n  - Examples: check for pending tasks, review recent outputs, flag blockers to teammates.\n  - If nothing applies, output: # No periodic tasks for this agent\n\nReturn JSON with these exact keys. Values are full markdown file contents (escape newlines as \\n):\n{\"soul\":\"\",\"agentsMd\":\"\",\"userMd\":\"\",\"identityMd\":\"\",\"heartbeat\":\"\"}",
        "zh": "只输出合法JSON。不要Markdown代码块，不要解释。\n\n你正在为多智能体系统编写 OpenClaw 智能体工作区文件。\n智能体名称：{{agentName}}\n智能体角色：{{agentRole}}\n智能体描述：{{agentDesc}}\n团队/场景：{{scenarioName}}\n所有内容用：中文编写\n\n文件规范 — 严格遵守：\n\nSOUL.md — 人设、风格和边界。每次会话加载。\n  - 以第一人称书写，代入该智能体身份。\n  - 涵盖：这个智能体是谁、核心价值观、工作原则、沟通风格。\n  - 3-5个短段落。使用Markdown标题：## 核心信念, ## 边界, ## 风格\n  - 内容要针对该智能体角色，不要写通用AI套话。\n\nAGENTS.md — 操作指引和记忆规则。每次会话加载。\n  - 必须以 \"## 会话启动\" 开头，列出唤醒时需读取的文件：\n    1. 读取 SOUL.md — 这是你的身份\n    2. 读取 USER.md — 这是你服务的用户\n    3. 读取 memory/YYYY-MM-DD.md（今天+昨天）获取近期上下文\n  - 必须包含 \"## 红线\"（该角色绝对不能做的事情）。\n  - 必须包含针对该角色的操作规则、优先级和协作说明。\n  - 全文使用Markdown标题和无序列表。\n\nUSER.md — 该智能体服务的用户画像。每次会话加载。\n  - 必须使用以下精确模板格式（字段值留空——智能体在真实交互中自行填写）：\n    # USER.md - 关于你的用户\n\n    - **姓名：**\n    - **称呼：**\n    - **代词：** _（可选）_\n    - **时区：**\n    - **备注：**\n\n    ## 背景\n\n    _（该用户在此智能体职责范围内关心什么？他们的目标是什么？随时间积累补充。）_\n  - 不要预填字段值。\n\nIDENTITY.md — 智能体的名字、形象、气质和emoji。在引导阶段创建。\n  - 必须使用以下精确格式（多行，每行一个字段）：\n    # IDENTITY.md - 我是谁？\n\n    - **名字：** （适合该角色的名字）\n    - **形象：** （AI？专家？顾问？符合角色的定位）\n    - **气质：** （2-4个词：如何展现自己——精准？温暖？冷静？）\n    - **Emoji：** （一个符合该智能体个性的emoji）\n  - 不要添加名字、形象、气质、Emoji之外的额外字段。\n\nHEARTBEAT.md — 后台周期性工作的简短清单。保持精简以避免浪费token。\n  - 格式：Markdown复选框 \"- [ ] 任务\"\n  - 最多2-4项。每项必须具体、可执行，且针对该智能体的职责。\n  - 示例：检查待处理任务、审查近期输出、向队友汇报阻碍。\n  - 如果该角色没有适用的周期性任务，输出：# 该智能体暂无周期性任务\n\n返回包含以下精确键名的JSON。值为完整的Markdown文件内容（换行符转义为\\n）：\n{\"soul\":\"\",\"agentsMd\":\"\",\"userMd\":\"\",\"identityMd\":\"\",\"heartbeat\":\"\"}"
      }
    }
  }
}
