{
  "id": "education",
  "version": "1.0.0",
  "type": "multi-agent",
  "metadata": {
    "name": "Education Content",
    "description": "Online education content team creating courses, quizzes, video scripts and learning materials",
    "category": "education",
    "icon": "school",
    "color": "from-teal-500 to-cyan-500",
    "tags": [
      "education",
      "content",
      "learning",
      "instructional-design"
    ],
    "author": "ClawDeckX Team",
    "scope": "multi-agent"
  },
  "content": {
    "agents": [],
    "workflow": {
      "type": "sequential",
      "description": "",
      "steps": []
    },
    "prompts": {
      "step1": {
        "en": "Output ONLY valid JSON, no markdown.\n\nYou are designing an Education Content multi-agent team.\nScenario: {{scenarioName}}\nDescription: {{description}}\nAgents: {{agentCount}}\nWorkflow: sequential\n\nCreate a realistic instructional design team. Typical roles: instructional designer (learning objectives, curriculum structure, pedagogy), subject matter expert (domain accuracy, depth, examples), content writer (scripts, reading materials, explanations), assessment designer (quizzes, projects, rubrics, answer keys), quality reviewer (accuracy check, readability, learner experience audit). Adjust for team size.\n\nFor each agent: id (kebab-case), name, role (≤8 words), description (≤20 words), icon (Material Symbol), color (Tailwind gradient).\nreasoning: ≤15 words. Workflow: sequential — curriculum design → expert content → writing → assessment → review.\n\n{\"reasoning\":\"\",\"template\":{\"id\":\"\",\"name\":\"\",\"description\":\"\",\"agents\":[{\"id\":\"\",\"name\":\"\",\"role\":\"\",\"description\":\"\",\"icon\":\"\",\"color\":\"\"}],\"workflow\":{\"type\":\"sequential\",\"description\":\"\",\"steps\":[{\"agent\":\"\",\"action\":\"\"}]}}}",
        "zh": "只输出合法JSON，不要Markdown。\n\n你正在设计一个教育内容多智能体团队。\n场景：{{scenarioName}}\n描述：{{description}}\n智能体数量：{{agentCount}}\n工作流：顺序\n\n创建一个符合实际的教学设计团队。典型角色：教学设计师（学习目标、课程结构、教学法）、领域专家（领域准确性、深度、示例）、内容写作者（脚本、阅读材料、讲解）、评估设计师（测验、项目、评分标准、答案）、质量审核员（准确性检查、可读性、学习者体验审查）。根据团队规模调整。\n\n每个智能体：id（短横线格式）、名称、角色（≤8字）、描述（≤20字）、图标（Material Symbol）、颜色（Tailwind渐变）。\n推理：≤15字。工作流：顺序——课程设计→专家内容→写作→评估→审核。\n\n{\"reasoning\":\"\",\"template\":{\"id\":\"\",\"name\":\"\",\"description\":\"\",\"agents\":[{\"id\":\"\",\"name\":\"\",\"role\":\"\",\"description\":\"\",\"icon\":\"\",\"color\":\"\"}],\"workflow\":{\"type\":\"sequential\",\"description\":\"\",\"steps\":[{\"agent\":\"\",\"action\":\"\"}]}}}"
      },
      "agentFile": {
        "en": "Output ONLY valid JSON. Field values must be rich Markdown, NOT plain sentences.\n\nAgent: {{agentName}}\nRole: {{agentRole}}\nDescription: {{agentDesc}}\nTeam / Scenario: {{scenarioName}}\nLanguage: English\n\nFields:\n- soul: First-person Markdown persona (3-5 paragraphs). Cover: educational philosophy and approach to learning design (constructivism, active recall, spaced repetition, scaffolding — whatever fits this role); specific expertise domain (curriculum architecture, subject mastery, writing clarity, assessment validity, quality standards — tailored to this agent's function); how they collaborate with other team members and what inputs/outputs they depend on; their standard for learner success (engagement, comprehension, retention, skill transfer); a guiding principle for creating effective education.\n- agentsMd: Session-startup guide (Markdown). Include: what prior curriculum drafts, learning objectives, SME notes, or style guides to review first; primary deliverable for this session (learning objective map, module outline, lesson script, quiz bank, rubric, review feedback); quality criteria to apply (Bloom's taxonomy level, reading grade, cognitive load, accessibility); handoff format for the next agent in the pipeline.\n\n- userMd: Markdown profile of the human this agent serves. Must use this exact template (leave values blank):\n  # USER.md - About Your Human\n  - **Name:**\n  - **What to call them:**\n  - **Pronouns:** _(optional)_\n  - **Timezone:**\n  - **Notes:**\n  ## Context\n  _(What do they care about relevant to this agent's role? Build this over time.)_\n  Do NOT pre-fill values.\n- identityMd: Exact multi-line format (no pipe/single-line format):\n  # IDENTITY.md - Who Am I?\n  - **Name:** (fitting name for this role)\n  - **Creature:** (AI? specialist? advisor? something fitting the role)\n  - **Vibe:** (2–4 words: how this agent comes across)\n  - **Emoji:** (one emoji)\n  Do NOT add extra fields.\n- heartbeat: Optional. First judge whether this agent genuinely has recurring background tasks. If YES: 2–4 specific \"- [ ] task\" items. If NO (purely reactive or session-driven): output exactly: # No periodic tasks for this agent. Never pad with vague items.\n\n{\"soul\":\"\",\"agentsMd\":\"\",\"userMd\":\"\",\"identityMd\":\"\",\"heartbeat\":\"\"}",
        "zh": "只输出合法JSON。字段必须是丰富的Markdown，不是简短句子。\n\n智能体：{{agentName}}\n角色：{{agentRole}}\n描述：{{agentDesc}}\n团队/场景：{{scenarioName}}\n语言：中文\n\n字段：\n- soul：第一人称Markdown人设（3-5段）。涵盖：教育哲学和学习设计方法（建构主义、主动回忆、间隔重复、脚手架教学——适合该角色的方法）；具体专长领域（课程架构、学科掌握、写作清晰度、评估有效性、质量标准——针对该智能体职能）；如何与其他团队成员协作及依赖的输入/输出；学习者成功的标准（参与度、理解力、记忆保留、技能迁移）；创造有效教育的指导原则。\n- agentsMd：会话启动指南（Markdown）。包含：首先审阅哪些先前课程草稿、学习目标、专家笔记或风格指南；本次会话主要交付物（学习目标图谱、模块大纲、课程脚本、题库、评分标准、审核反馈）；适用的质量标准（布鲁姆分类层级、阅读难度、认知负荷、无障碍性）；流水线中下一个智能体的交接格式。\n- userMd：该智能体服务的课程负责人、教学总监或平台编辑的Markdown画像。涵盖：目标学习者受众和学习目标；执行的内容标准和品牌声音；交付周期期望和修改容忍度；对他们来说\"可发布\"的交付物标准。\n- identityMd：严格一行：\"Name: X | Creature: X | Vibe: X | Emoji: X\" —— 选择反映该智能体教学或设计个性的动物。\n- heartbeat：5-7个复选框（- [ ] 任务）：针对该角色的周期性内容生产职责（如审查学习目标对齐度、检查阅读难度、验证测验答案、审核无障碍性、交叉核对专家准确性、检查风格合规性、标记范围蔓延）。\n\n{\"soul\":\"\",\"agentsMd\":\"\",\"userMd\":\"\",\"identityMd\":\"\",\"heartbeat\":\"\"}\n- userMd：用户画像。必须使用以下精确模板格式（字段值留空，智能体在真实交互中自行填写）：\n  # USER.md - 关于你的用户\n  - **姓名：**\n  - **称呼：**\n  - **代词：** _（可选）_\n  - **时区：**\n  - **备注：**\n  ## 背景\n  _（该用户在此智能体职责范围内关心什么？随时间积累补充。）_\n  不要预填字段值。\n- identityMd：严格多行格式（不使用 | 分隔的单行格式）：\n  # IDENTITY.md - 我是谁？\n  - **名字：** （适合该角色的名字）\n  - **形象：** （AI？专家？顾问？符合角色的定位）\n  - **气质：** （2-4个词：如何展现自己）\n  - **Emoji：** （一个符合个性的emoji）\n  不要添加额外字段。\n- heartbeat：可选。首先判断该智能体是否真的有周期性后台任务。有则写2-4条具体 \"- [ ] 任务\"；如果没有（纯被动响应）则输出：# 该智能体暂无周期性任务。不要凑数。\n\n{\"soul\":\"\",\"agentsMd\":\"\",\"userMd\":\"\",\"identityMd\":\"\",\"heartbeat\":\"\"}"
      }
    }
  }
}
